<?xml version="1.0" encoding="UTF-8" ?>
<persons xmlns:xsi="http://www.w3.org/2001/XMLSchema-instance"
         xmlns="http://beans.jd02_09.lobkova.it.by"
         xsi:schemaLocation="http://beans.jd02_09.lobkova.it.by  person.xsd"
>
    <person>
    <email>dashabertosh@gmail.com</email>
    <nickname>Dasha_Bertosh</nickname>
    <password>bertosh1980</password>
    <goals>
        <goal>
            <name_goal>Похудеть на 8 кг</name_goal>
            <description_goal>В течении заданного времени похудеть на 8 кг и накачать пресс</description_goal>
            <startTime>01.01.2019</startTime>
            <endTime>01.03.2019</endTime>
            <tasks>
                <task>
                    <name_task>Уренняя пробежка</name_task>
                    <description_task>Выполнить утреннюю пробежку 3 км вокруг стадиона</description_task>
                    <date>02.01.2019</date>
                    <repeat>Каждый вторник</repeat>
                </task>
                <task>
                    <name_task>Исключить вредные продукты</name_task>
                    <description_task>Исключить из рациона жаренное, мучное, сладкое</description_task>
                    <date>01.01.2019</date>
                    <repeat>Каждый день</repeat>
                </task>
            </tasks>
        </goal>
    </goals>
</person>
</persons>